{"version":"system-roi-ledger-v1","period":"2026-08","review_status":"not_reviewed","metrics":[{"name":"ops_minutes","unit":"minutes","evidence_status":"unknown","value":12,"provenance":{"kind":"owner_input_required","reference":"not supplied"}}],"service_decisions":[],"system_decision":{"value":null,"evidence_status":"unknown","provenance":{"kind":"owner_input_required","reference":"not supplied"}}}
