{"version":"system-roi-ledger-v1","period":"2026-08","review_status":"not_reviewed","metrics":[],"service_decisions":[{"service":"hugin","decision":"keep","evidence_status":"measured","evidence":"used","provenance":{"kind":"measurement","reference":"report"}}],"system_decision":{"value":null,"evidence_status":"unknown","provenance":{"kind":"owner_input_required","reference":"not supplied"}}}
